Title,URL,Document ID,Authors,Conference/Journal,Year,Code Link,Code Context
Transportation Economic Management Strategy of Cold Chain Transportation Industry Based on ABC-ACO Algorithm,https://ieeexplore.ieee.org/document/9974014/,9974014,Tong Wu; ,"2022 International Conference on Data Analytics, Computing and Artificial Intelligence (ICDACAI)",2022,,
Smart City and Intelligent Upgrading of Urban Transportation System: based on Sustainable Investment Strategy,https://ieeexplore.ieee.org/document/10047675/,10047675,Jun Qiao; ,"2022 Second International Conference on Advanced Technologies in Intelligent Control, Environment, Computing & Communication Engineering (ICATIECE)",2022,,
Resource Allocation Optimization for Airport Landside Multi-modal Transportation: A Simulation Case Study in Beijing Daxing International Airport,https://ieeexplore.ieee.org/document/10101452/,10101452,Xinghao Lou; Ailing Huang; Yufei Yuan; Mingjie Li; ; ; ; ,2022 IEEE 7th International Conference on Intelligent Transportation Engineering (ICITE),2022,,
Construction of autonomous transportation system architecture based on system engineering methodology,https://ieeexplore.ieee.org/document/9921842/,9921842,Zi-sheng Zhou; Ming Cai; Chen Xiong; Zhuo-lin Deng; Yuezhao Yu; ; ; ; ; ,2022 IEEE 25th International Conference on Intelligent Transportation Systems (ITSC),2022,,
Empty Container Allocation and Transshipment in Road-Rail Transportation Network,https://ieeexplore.ieee.org/document/9970786/,9970786,Mingzhu Yu; Zhishan Yu; Bo Jin; Junfeng Wu; ; ; ; ,2022 IEEE International Symposium on Product Compliance Engineering - Asia (ISPCE-ASIA),2022,,
Smart Transportation- A Futuristic Intelligent Mobility Approach towards Smarter Cities,https://ieeexplore.ieee.org/document/9989297/,9989297,Akhilesh Kumar Singh; Damodar Reddy Edla; ; ,"2022 IEEE 4th International Conference on Cybernetics, Cognition and Machine Learning Applications (ICCCMLA)",2022,,
Optimization of construction waste transportation path for urban roads based on ECEA algorithm,https://ieeexplore.ieee.org/document/9873803/,9873803,Zhang Eryue; Jingyan Qi; ; ,"2022 IEEE 4th International Conference on Power, Intelligent Computing and Systems (ICPICS)",2022,,
Optimal Solutions of the Bulk Transportation Problem with Two Criteria and Two Modes of Transportation,https://ieeexplore.ieee.org/document/9752068/,9752068,Sudhir Kumar Chauhan; Renu Tuli; Nidhi Sindhwani; Pallavi Khanna; ; ; ; ,2022 International Mobile and Embedded Technology Conference (MECON),2022,,
Distribution Path Optimization for Intelligent Logistics Vehicles of Urban Rail Transportation Using VRP Optimization Model,https://ieeexplore.ieee.org/document/9523511/,9523511,Kaijun Leng; Shanghong Li; ; ,IEEE Transactions on Intelligent Transportation Systems,2022,,
Multiagent Reinforcement Learning-Based Signal Planning for Resisting Congestion Attack in Green Transportation,https://ieeexplore.ieee.org/document/9743567/,9743567,Yike Li; Wenjia Niu; Yunzhe Tian; Tong Chen; Zhiqiang Xie; Yalun Wu; Yingxiao Xiang; Endong Tong; Thar Baker; Jiqiang Liu; ; ; ; ; ; ; ; ; ; ,IEEE Transactions on Green Communications and Networking,2022,,
Real-Time Intelligent Automatic Transportation Safety Based on Big Data Management,https://ieeexplore.ieee.org/document/9529095/,9529095,Yishu Liu; Qi Zhang; Zhihan Lv; ; ; ,IEEE Transactions on Intelligent Transportation Systems,2022,,
Modified Approach for Optimization of Unbalanced Fuzzy Transportation Problem,https://ieeexplore.ieee.org/document/10097320/,10097320,Lokesh Kumar Bhuranda; Mohammad Rizwanullah; ; ,"2022 International Conference on Computational Modelling, Simulation and Optimization (ICCMSO)",2022,,
A New Approach to Solve Fully Fuzzy Multi-Objective Transportation Problem,https://ieeexplore.ieee.org/document/10479104/,10479104,Malihe Niksirat; ,Fuzzy Information and Engineering,2022,,
The Impacts of the Cross-Chain Collaboration Center Model on Transportation Performance: A Case Study of a Bulk Transportation Network in Thailand,https://ieeexplore.ieee.org/document/9787488/,9787488,Apichit Maneengam; Apinanthana Udomsakdigool; ; ,IEEE Access,2022,,
A Hybrid Deep Neural Network for Classifying Transportation Modes based on Human Activity Vibration,https://ieeexplore.ieee.org/document/9729079/,9729079,Sakorn Mekruksavanich; Ponnipa Jantawong; Ilsun You; Anuchit Jitpattanakul; ; ; ; ,2022 14th International Conference on Knowledge and Smart Technology (KST),2022,,
System Design and Performance of Ship-borne Satellite High-speed Data Reliable Transportation Based on Coded STBC-OFDM,https://ieeexplore.ieee.org/document/9778435/,9778435,Rulong He; Zhao Shen; ; ,2022 7th International Conference on Intelligent Computing and Signal Processing (ICSP),2022,,
Deep Learning for Security in Digital Twins of Cooperative Intelligent Transportation Systems,https://ieeexplore.ieee.org/document/9560727/,9560727,Zhihan Lv; Yuxi Li; Hailin Feng; Haibin Lv; ; ; ; ,IEEE Transactions on Intelligent Transportation Systems,2022,,
Modeling and Simulation of Dedicated Railway Transportation Dispatching System Based on Petri Net,https://ieeexplore.ieee.org/document/10062287/,10062287,Xin Bai; Qianguo Chen; Lijun Sun; Qingfang Teng; ; ; ; ,2022 4th International Academic Exchange Conference on Science and Technology Innovation (IAECST),2022,,
Multi-objective multimodal transport path optimization model and algorithm considering carbon emissions,https://ieeexplore.ieee.org/document/10087489/,10087489,ZIjian ZHANG; Decang LI; Jianjun MENG; Minghe JIANG; ; ; ; ,"2022 2nd International Conference on Algorithms, High Performance Computing and Artificial Intelligence (AHPCAI)",2022,,
An Autonomous Transportation System Architecture Mapping Relation Generation Method Based on Text Analysis,https://ieeexplore.ieee.org/document/9753675/,9753675,Zhuolin Deng; Chen Xiong; Ming Cai; ; ; ,IEEE Transactions on Computational Social Systems,2022,,
An empirical study on the behavior pattern of intercity shared mobility,https://ieeexplore.ieee.org/document/9922406/,9922406,Zilin Chen; Jing Fang; Jianru Xiao; Yuhao Liang; Yilong Ren; Runkun Liu; ; ; ; ; ; ,2022 IEEE 25th International Conference on Intelligent Transportation Systems (ITSC),2022,,
IoT Enabled Security Management Approach for Intelligent Transportation System in Smart Cities,https://ieeexplore.ieee.org/document/9997813/,9997813,Sumit; Rajender Singh Chhillar; ; ,2022 IEEE 6th Conference on Information and Communication Technology (CICT),2022,,
Structural Features of Public Bicycle Transportation Networks over Times of the Day: The Case of Seoul Public Bicycle,https://ieeexplore.ieee.org/document/9736521/,9736521,Il-Jung Seo; Jaehee Cho; ; ,2022 IEEE International Conference on Big Data and Smart Computing (BigComp),2022,,
Integrated Management Platform for Spent Nuclear Fuel Storage and Transportation,https://ieeexplore.ieee.org/document/10067706/,10067706,Zuokai Chen; Jipu Wang; Ming Yang; Sijuan Chen; Xiaomeng Dong; Anqi Xu; ; ; ; ; ; ,2022 4th International Conference on System Reliability and Safety Engineering (SRSE),2022,,
Application of Data Mining Techniques for the Investigation of Factors Affecting Transportation Enterprises,https://ieeexplore.ieee.org/document/9485057/,9485057,Mahdi Yousefi Nejad Attari; Babak Ejlaly; Hannaneh Heidarpour; Ali Ala; ; ; ; ,IEEE Transactions on Intelligent Transportation Systems,2022,,
Making Standards for Smart Mining Operations: Intelligent Vehicles for Autonomous Mining Transportation,https://ieeexplore.ieee.org/document/9916212/,9916212,Shirong Ge; Fei-Yue Wang; Jianjian Yang; Zhen Ding; Xiao Wang; Yuchen Li; Siyu Teng; Zhongmin Liu; Yunfeng Ai; Long Chen; ; ; ; ; ; ; ; ; ; ,IEEE Transactions on Intelligent Vehicles,2022,,
Research on Calculation Method of Traffic Stations Scale of Comprehensive Transportation Hub,https://ieeexplore.ieee.org/document/9980972/,9980972,Yan Duan; Lixia Gao; Peifeng Wu; ; ; ,"2022 International Conference on Manufacturing, Industrial Automation and Electronics (ICMIAE)",2022,,
Technologies in Transportation Engineering,https://ieeexplore.ieee.org/document/10125556/,10125556,Akhilesh Tiwari; Rakesh Mehar; Mahaveer Singh Naruka; Parikshit Vasisht; Sudhakar Ranjan; Anuranjan Sharma; ; ; ; ; ; ,2022 International Conference on Smart and Sustainable Technologies in Energy and Power Sectors (SSTEPS),2022,,
"The Matlab Realization of the Fusion Information Framework of Guangdong, Hong Kong and Macao by the Low-Altitude Sensor Network Construction of Civil Aviation Transportation Industry",https://ieeexplore.ieee.org/document/9885331/,9885331,Xiaohui Jia; ,2022 3rd International Conference on Electronics and Sustainable Communication Systems (ICESC),2022,,
Internet of Things Technology and LSTM-based Data Imputation and Prediction for Transportation Industry,https://ieeexplore.ieee.org/document/9997076/,9997076,Yifan Wang; Fanliang Bu; Fanxu Meng; Jingyi Mao; ; ; ; ,"2022 International Conference on Electronics and Devices, Computational Science (ICEDCS)",2022,,
A Deep Residual Network for Recognizing Transportation Vehicles using Smartphone Sensors,https://ieeexplore.ieee.org/document/9930314/,9930314,Narit Hnoohom; Nagorn Maitrichit; Sakorn Mekruksavanich; Anuchit Jitpattanakul; ; ; ; ,2022 IEEE 13th International Conference on Software Engineering and Service Science (ICSESS),2022,,
The Intelligent Control System Function Mechanism for International Container Freight Transportation,https://ieeexplore.ieee.org/document/9976637/,9976637,Julia A. Tagiltseva; Elena L. Kuzina; Marina A. Vasilenko; Pavlina L. Artamonova; Maxim M. Bozin; Anastasia V. Revenkova; ; ; ; ; ; ,"2022 International Conference on Quality Management, Transport and Information Security, Information Technologies (IT&QM&IS)",2022,,
AFFIRM: Provably Forward Privacy for Searchable Encryption in Cooperative Intelligent Transportation System,https://ieeexplore.ieee.org/document/9788514/,9788514,Ke Wang; Chien-Ming Chen; Mohammad Shojafar; Zhuoyu Tie; Mamoun Alazab; Saru Kumari; ; ; ; ; ; ,IEEE Transactions on Intelligent Transportation Systems,2022,https://github.com/,"e Code . [Online]. Available: https://github.com/
wangke200/wangke200
[33] P. W"
Application of Laser Detector in Intelligent Transportation System,https://ieeexplore.ieee.org/document/10086433/,10086433,Qian Xie; WenZhi Qin; HePing Xie; Xu Pan; QingMin Chen; Yuan Liu; HongJun Tian; Shuai Huang; ; ; ; ; ; ; ; ,"2022 International Conference on Computing, Robotics and System Sciences (ICRSS)",2022,,
Design of intelligent transportation verification platform based on hardware in the loop simulation technology,https://ieeexplore.ieee.org/document/10042519/,10042519,Jinwei Guo; Ziyan Li; Haibo Dong; Ran Li; Ning Sun; ; ; ; ; ,2022 8th International Conference on Hydraulic and Civil Engineering: Deep Space Intelligent Development and Utilization Forum (ICHCE),2022,,
Informatization under Internet Big Data on Improving the Management Level of Civil Aviation Transportation,https://ieeexplore.ieee.org/document/10031976/,10031976,Lei Xing; Xiaxin Xu; ; ,2022 IEEE 2nd International Conference on Mobile Networks and Wireless Communications (ICMNWC),2022,,
Mitigating the Vulnerability of a High-Speed Railway–Air Network by Optimizing the Location of Integrated Transportation Hubs,https://ieeexplore.ieee.org/document/9961100/,9961100,Cai Cui; Feng Xiao; Pei Aihui; Li Tao; Yuan Junli; ; ; ; ; ,IEEE Access,2022,,
A Cross-Domain Scientometric Analysis of Situational Awareness of Autonomous Vehicles With Focus on the Maritime Domain,https://ieeexplore.ieee.org/document/9771451/,9771451,Krzysztof Bogusławski; Jan Nasur; Jie Li; Mateusz Gil; Krzysztof Wróbel; Floris Goerlandts; ; ; ; ; ; ,IEEE Access,2022,,
Mining Hub Nodes Based on Fast Brandes Betweenness Centrality in a Weighted Complex Transportation Network,https://ieeexplore.ieee.org/document/9955146/,9955146,Tao Liu; Weiyan Liu; Jun Chen; ; ; ,"2022 International Conference on Machine Learning, Cloud Computing and Intelligent Mining (MLCCIM)",2022,,
Evaluating the economic performance of a decentralized waterborne container transportation service using autonomous inland vessels,https://ieeexplore.ieee.org/document/9922500/,9922500,Cyril Alias; Jonas Zum Felde; ; ,2022 IEEE 25th International Conference on Intelligent Transportation Systems (ITSC),2022,,
Autonomous Transportation Systems and Services Enabled by the Next-Generation Network,https://ieeexplore.ieee.org/document/9829314/,9829314,Linlin You; Junshu He; Wei Wang; Ming Cai; ; ; ; ,IEEE Network,2022,,
Analysis of Requirements for Next-Generation Complex Urban and Transportation System Simulation,https://ieeexplore.ieee.org/document/10014795/,10014795,Vitaly Stepanyants; Aleksandr Romanov; ; ,"2022 Dynamics of Systems, Mechanisms and Machines (Dynamics)",2022,,
Study on the Layout of Electric Vehicle Charging and Switching Facilities under Green Transportation System,https://ieeexplore.ieee.org/document/10380081/,10380081,Xinhong Wang; Yiwen Yao; Yuanqi Liu; Peng Liu; Yuchun Liu; Dong Wang; Yunjing Lv; ; ; ; ; ; ; ,2022 International Conference on Smart City and Green Energy (ICSCGE),2022,,
Supply chain risks in transportation and distribution in the Covid-19 Era: an Exploratory Study of Moroccan companies,https://ieeexplore.ieee.org/document/9938060/,9938060,EL Bhilat El Mehdi; Hamidi Lalla Saadia; ; ,2022 14th International Colloquium of Logistics and Supply Chain Management (LOGISTIQUA),2022,,
Electrical Vehicle Charging Scheduling and Routing Mechanism in Interdependent Power and Transportation Networks,https://ieeexplore.ieee.org/document/9949771/,9949771,Shafqat Jawad; Junyong Liu; ; ,2022 IEEE/IAS Industrial and Commercial Power System Asia (I&CPS Asia),2022,,
Application of Lightweight Digital Twin System in Intelligent Transportation,https://ieeexplore.ieee.org/document/9911638/,9911638,Qian Liu; Xiaoqing Qi; Shanshan Liu; Xiuju Cheng; Xin Ke; Feng Wang; ; ; ; ; ; ,IEEE Journal of Radio Frequency Identification,2022,,
Traffic Prediction for Intelligent Transportation System Using Machine Learning,https://ieeexplore.ieee.org/document/9807652/,9807652,V. Swathi; Sirisha Yerraboina; G. Mallikarjun; M. JhansiRani; ; ; ; ,"2022 Second International Conference on Advances in Electrical, Computing, Communication and Sustainable Technologies (ICAECT)",2022,,
Optimal Inventory Policy in Oil Transportation: A Case Study,https://ieeexplore.ieee.org/document/9795774/,9795774,Rasha Kashef; Shuo Xu; ; ,"2022 IEEE International IOT, Electronics and Mechatronics Conference (IEMTRONICS)",2022,,
Toward a Framework for Embodiment in Emerging Transportation Technologies for Facilitating In-Vehicle Experiences for Vulnerable and Disabled Road Users,https://ieeexplore.ieee.org/document/9980810/,9980810,Aaron Gluck; Earl W. Huff; Kwajo Boateng; Julian Brinkley; ; ; ; ,2022 IEEE 3rd International Conference on Human-Machine Systems (ICHMS),2022,,
Solution of Stochastic Transportation Problem Involving Multi-choice Constraints of Exponential Distribution using Lagrange’s Interpolation,https://ieeexplore.ieee.org/document/9825146/,9825146,Kamana Mishra; Saptadeep Biswas; Uttam Kumar Bera; ; ; ,2022 IEEE 7th International conference for Convergence in Technology (I2CT),2022,,
Reliability Evaluation and Analysis of Coupled Urban Power Distribution and Transportation Networks,https://ieeexplore.ieee.org/document/10117108/,10117108,Zhigang Lu; Yang Dong; Liangce He; Yao Cai; Lu Sui; ; ; ; ; ,2022 IEEE 6th Conference on Energy Internet and Energy System Integration (EI2),2022,,
IEUM: Bridging Transportation to Humans,https://ieeexplore.ieee.org/document/9889531/,9889531,Seonghee Lee; Jin Ryu; Jee Yoon Kim; ; ; ,2022 17th ACM/IEEE International Conference on Human-Robot Interaction (HRI),2022,,
Eliciting User Needs of Intelligent Transportation Systems in the Context of Autonomous Driving: An Application of Activity Theory,https://ieeexplore.ieee.org/document/9921987/,9921987,Lai Zheng; Wei Wei; Ming Cai; ; ; ,2022 IEEE 25th International Conference on Intelligent Transportation Systems (ITSC),2022,,
Age of Information Aware UAV Deployment for Intelligent Transportation Systems,https://ieeexplore.ieee.org/document/9576539/,9576539,Rui Han; Yongqing Wen; Lin Bai; Jianwei Liu; Jinho Choi; ; ; ; ; ,IEEE Transactions on Intelligent Transportation Systems,2022,,
A Task Offloading Incentive Mechanism for Vehicle Platoon in Intelligent Transportation System,https://ieeexplore.ieee.org/document/9921879/,9921879,Yanan Zhao; Runkun Liu; Zhengxing Lan; Han Jiang; Shuai Liu; Yilong Ren; ; ; ; ; ; ,2022 IEEE 25th International Conference on Intelligent Transportation Systems (ITSC),2022,,
Lightweight Tensor Deep Computation Model With Its Application in Intelligent Transportation Systems,https://ieeexplore.ieee.org/document/9725249/,9725249,Debin Liu; Laurence T. Yang; Ruonan Zhao; Jiawei Wang; Xia Xie; ; ; ; ; ,IEEE Transactions on Intelligent Transportation Systems,2022,,
Competitive Multi-Agent Reinforcement Learning for Traffic Signal Control,https://ieeexplore.ieee.org/document/10036251/,10036251,Bálint Kóvári; Máté Kolat; Tamás Bécsi; Szilárd Aradi; ; ; ; ,2022 IEEE 20th Jubilee International Symposium on Intelligent Systems and Informatics (SISY),2022,,
Demo: Deterministic Radio Propagation Simulation for Integrated Communication Systems in Multimodal Intelligent Transportation Scenarios,https://ieeexplore.ieee.org/document/9915017/,9915017,Hagen Ußler; Katharina Porepp; Jonas Ninnemann; Paul Schwarzbach; Oliver Michler; ; ; ; ; ,2022 IEEE International Conference on Communications Workshops (ICC Workshops),2022,,
A New Technique For Deciding On The Interval Type-2 Fuzzy Transportation Problem Based On Interval Linear Programming Problems,https://ieeexplore.ieee.org/document/9756496/,9756496,Moslem Javanmard; Hassan Mishmast Nehi; ; ,2022 9th Iranian Joint Congress on Fuzzy and Intelligent Systems (CFIS),2022,,
An Effective Practical Approach for LDM in China’s Cooperative Intelligent Transportation System,https://ieeexplore.ieee.org/document/10101434/,10101434,Changlong Zhang; Jimin Wei; Peipei Fu; Jingang Dai; Xianning She; Shibo Qu; ; ; ; ; ; ,2022 IEEE 7th International Conference on Intelligent Transportation Engineering (ICITE),2022,,
A New Algorithm For The Initial Feasible Solutions Of Fixed Charge Transportation Problem,https://ieeexplore.ieee.org/document/9919524/,9919524,Nermin Kartlı; Erkan Bostancı; Mehmet Serdar Güzel; ; ; ,2022 7th International Conference on Computer Science and Engineering (UBMK),2022,,
Cluster Analysis on Sustainable Transportation: The Case of New York City Open Data,https://ieeexplore.ieee.org/document/9801569/,9801569,Gerjane Joy Cabunagan-Cinco; Enayat Rajabi; Slawomir Nowaczyk; ; ; ,2022 International Conference on Applied Artificial Intelligence (ICAPAI),2022,https://github.com/erajabi/NYC_Mobility_Clustering," 0.89 0.89 0.88 0.95 
 
 
 
3 https://github.com/erajabi/NYC_Mobility_Clustering   Fig. 2.  ROC Curve   
V. CL"
A Flexible System-level Hydrogen Transportation System Operating Structure Interacting with Urban Transportation System,https://ieeexplore.ieee.org/document/10000113/,10000113,Elahe Sahraie; Innocent Kamwa; ; ,2022 IEEE Electrical Power and Energy Conference (EPEC),2022,,
Multi-step Road Network Speed Prediction Based on Graph Convolution Long Short-Term Memory Neural Network,https://ieeexplore.ieee.org/document/10101438/,10101438,Chaoqiang Liang; Yangzhou Chen; Zeyu Shi; ; ; ,2022 IEEE 7th International Conference on Intelligent Transportation Engineering (ICITE),2022,,
RFAP: A Revocable Fine-Grained Access Control Mechanism for Autonomous Vehicle Platoon,https://ieeexplore.ieee.org/document/9523580/,9523580,Yanan Zhao; Yunpeng Wang; Xiaochun Cheng; Hengwei Chen; Haiyang Yu; Yilong Ren; ; ; ; ; ; ,IEEE Transactions on Intelligent Transportation Systems,2022,,
"Co-simulation of Power Grid, Information Network and Transportation Network Simulation System",https://ieeexplore.ieee.org/document/9832036/,9832036,Yongmin Shuai; Yu Zhang; Fuhao Liu; Xiaobin Qiao; Yunfei Xiong; Yong Zeng; ; ; ; ; ; ,2022 IEEE 2nd International Conference on Software Engineering and Artificial Intelligence (SEAI),2022,,
Heterogeneous Knowledge Learning of Predictive Academic Intelligence in Transportation,https://ieeexplore.ieee.org/document/9298476/,9298476,Hao Lu; Yifan Zhu; Qika Lin; Tan Wang; Zhendong Niu; Enrique Herrera-Viedma; ; ; ; ; ; ,IEEE Transactions on Intelligent Transportation Systems,2022,,
Design of Integrated Platform for Vehicle-road Collaborative Perception in Smart Transportation,https://ieeexplore.ieee.org/document/9927677/,9927677,Teng Jiang; Wenxuan Liu; ; ,2022 IEEE 5th International Conference on Information Systems and Computer Aided Education (ICISCAE),2022,,
Intelligent Transportation Information Flow Transmission Model based on WSN and 5G Technology,https://ieeexplore.ieee.org/document/9987423/,9987423,Jun Xiao; Chuanlin Yuan; Meng Wang; ; ; ,"2022 Sixth International Conference on I-SMAC (IoT in Social, Mobile, Analytics and Cloud) (I-SMAC)",2022,,
Using GIS-Based Spatial Analysis: Comparing Pattern of Urbanization and Transportation Networks,https://ieeexplore.ieee.org/document/9902095/,9902095,Jirattikan Ammapa; Pisinee Visuttiporn; Jirawan Klaylee; Sararad Chayphong; Pawinee Iamtrakul; ; ; ; ; ,2022 10th International Conference on Traffic and Logistic Engineering (ICTLE),2022,,
Coordinated Expansion Planning of EV Charging Stations and Transportation-Distribution Network with Mixed Traffic Flow,https://ieeexplore.ieee.org/document/9783337/,9783337,Hui Lu; Bo Hu; Bo Huang; Congcong Pan; Changzheng Shao; Kaigui Xie; ; ; ; ; ; ,"2022 5th International Conference on Energy, Electrical and Power Engineering (CEEPE)",2022,,
Blockchain in Big Data Security for Intelligent Transportation With 6G,https://ieeexplore.ieee.org/document/9529089/,9529089,Zhili Zhou; Meimin Wang; Jingwang Huang; Shengliang Lin; Zhihan Lv; ; ; ; ; ,IEEE Transactions on Intelligent Transportation Systems,2022,,
Optimal Method of EMU Routing Planning based on Variable Formation,https://ieeexplore.ieee.org/document/9921826/,9921826,Bin Zhang; Yixiang Yue; Xiangyu Su; ; ; ,2022 IEEE 25th International Conference on Intelligent Transportation Systems (ITSC),2022,,
Blockchain-Based Secure Communication of Intelligent Transportation Digital Twins System,https://ieeexplore.ieee.org/document/9810813/,9810813,Jun Liu; Lei Zhang; Chunlin Li; Jingpan Bai; Haibin Lv; Zhihan Lv; ; ; ; ; ; ,IEEE Transactions on Intelligent Transportation Systems,2022,,
Enabling Radio Sensing for Multimodal Intelligent Transportation Systems: From Virtual Testing to Immersive Testbeds,https://ieeexplore.ieee.org/document/9743504/,9743504,Paul Schwarzbach; Jonas Ninnemann; Oliver Michler; ; ; ,2022 2nd IEEE International Symposium on Joint Communications & Sensing (JC&S),2022,,
Construction of Efficient Authenticated Key Agreement Protocol for Intelligent Transportation System,https://ieeexplore.ieee.org/document/10044359/,10044359,Kiranbala Nongthombam; Saurabh Rana; Mohammad S. Obaidat; Deepak Chhikara; Dheerendra Mishra; ; ; ; ; ,2022 2nd International Conference on Electronic Information Technology and Smart Agriculture (ICEITSA),2022,,
Research on Relay Pump and Pipeline Layout Optimization Technology for Ultra-long-distance Slurry Transportation of the Xiaomiaohong Dredging Project,https://ieeexplore.ieee.org/document/10042660/,10042660,Yong Wei; Chaozhe Yuan; Ronghui Zhu; Zenghai Yang; ; ; ; ,2022 8th International Conference on Hydraulic and Civil Engineering: Deep Space Intelligent Development and Utilization Forum (ICHCE),2022,,
Resilient Urban Public Transportation Infrastructure: A Comparison of Five Flow-Weighted Metro Networks in Terms of the Resilience Cycle Framework,https://ieeexplore.ieee.org/document/9592719/,9592719,Zizhen Xu; Shauhrat S. Chopra; Hellas Lee; ; ; ,IEEE Transactions on Intelligent Transportation Systems,2022,,
Analyzing the Railway Operation Network by Evaluating the Importance of Time-Space Nodes,https://ieeexplore.ieee.org/document/9851564/,9851564,Hanxiao Zhou; Leishan Zhou; Bin Guo; Zixi Bai; Zeyu Wang; ; ; ; ; ,IEEE Transactions on Network Science and Engineering,2022,,
Foundation Models for Transportation Intelligence: ITS Convergence in TransVerse,https://ieeexplore.ieee.org/document/10044573/,10044573,Chen Zhao; Xingyuan Dai; Yisheng Lv; Yonglin Tian; Yuhai Ren; Fei-Yue Wang; ; ; ; ; ; ,IEEE Intelligent Systems,2022,,
Dynamic Differential Pricing of High-Speed Railway Based on Improved GBDT Train Classification and Bootstrap Time Node Determination,https://ieeexplore.ieee.org/document/9529064/,9529064,Yun Jing; Siye Guo; Fangqiu Chen; Xuan Wang; Kaixuan Li; ; ; ; ; ,IEEE Transactions on Intelligent Transportation Systems,2022,,
Route Planning to Increase Transportation Efficiency: A Case Study of ABC Company Limited,https://ieeexplore.ieee.org/document/9786454/,9786454,Wasan Kanlaya; Phuwadon Waiyanet; Dhippayachut Sirisingh; ; ; ,2022 7th International Conference on Business and Industrial Research (ICBIR),2022,,
Pre-Predictive Congestion-Based Data Allocation for Sixth Generation Cooperative Intelligent Transportation Systems,https://ieeexplore.ieee.org/document/9899366/,9899366,Gunasekaran Manogaran; Ibrahim Alrayes; Amani Alshaikhi; Danda B. Rawat; ; ; ; ,IEEE Transactions on Intelligent Transportation Systems,2022,,
Optimal Facility Location and Network Design in Hazardous Materials Transportation via Lane Reservation,https://ieeexplore.ieee.org/document/10101466/,10101466,Yifan Yue; Xinyi Zhang; Peng Wu; ; ; ,2022 IEEE 7th International Conference on Intelligent Transportation Engineering (ICITE),2022,,
